{
  "$schema": "https://json-schema.org/draft/2020-12/schema",
  "$id": "https://nimdagame.local/schemas/ui_template.schema.json",
  "title": "UI Template",
  "type": "object",
  "required": ["schema_version", "id", "label", "canvas_size", "nodes"],
  "additionalProperties": false,
  "properties": {
    "schema_version": {
      "const": 1
    },
    "id": {
      "type": "string",
      "pattern": "^[a-z][a-z0-9_]*$"
    },
    "label": {
      "type": "string",
      "minLength": 1
    },
    "canvas_size": {
      "type": "array",
      "prefixItems": [
        {
          "type": "integer",
          "minimum": 1
        },
        {
          "type": "integer",
          "minimum": 1
        }
      ],
      "minItems": 2,
      "maxItems": 2
    },
    "nodes": {
      "type": "array",
      "items": {
        "type": "object",
        "required": ["id", "type", "slot", "rect", "text"],
        "additionalProperties": false,
        "properties": {
          "id": {
            "type": "string",
            "pattern": "^[a-z][a-z0-9_]*$"
          },
          "type": {
            "enum": ["panel", "button", "bar", "icon"]
          },
          "slot": {
            "type": "string"
          },
          "component": {
            "type": "string"
          },
          "rect": {
            "type": "array",
            "prefixItems": [
              {
                "type": "integer"
              },
              {
                "type": "integer"
              },
              {
                "type": "integer",
                "minimum": 1
              },
              {
                "type": "integer",
                "minimum": 1
              }
            ],
            "minItems": 4,
            "maxItems": 4
          },
          "text": {
            "type": "string"
          }
        }
      }
    }
  }
}
