{
  "schema_version": 1,
  "id": "megami_battle_hud",
  "label": "Megami Battle HUD",
  "canvas_size": [960, 540],
  "nodes": [
    {
      "id": "cover_panel",
      "type": "panel",
      "slot": "panel_primary",
      "rect": [24, 22, 590, 314],
      "text": "Cover Feature"
    },
    {
      "id": "polaroid_enemy_a",
      "type": "icon",
      "slot": "icon_frame",
      "rect": [418, 58, 86, 108],
      "text": "E1"
    },
    {
      "id": "polaroid_enemy_b",
      "type": "icon",
      "slot": "icon_frame",
      "rect": [506, 160, 86, 108],
      "text": "E2"
    },
    {
      "id": "memory_panel",
      "type": "panel",
      "slot": "panel_secondary",
      "rect": [34, 360, 354, 144],
      "text": "Collected Memories"
    },
    {
      "id": "hp_strip",
      "type": "bar",
      "slot": "status_bar",
      "rect": [62, 430, 278, 24],
      "text": "HP"
    },
    {
      "id": "command_panel",
      "type": "panel",
      "slot": "panel_secondary",
      "rect": [420, 356, 516, 152],
      "text": "Special Art"
    },
    {
      "id": "attack_button",
      "type": "button",
      "slot": "button_primary",
      "rect": [450, 414, 146, 46],
      "text": "Attack"
    },
    {
      "id": "skill_button",
      "type": "button",
      "slot": "button_primary",
      "rect": [614, 414, 146, 46],
      "text": "Skill"
    },
    {
      "id": "item_button",
      "type": "button",
      "slot": "button_primary",
      "rect": [778, 414, 126, 46],
      "text": "Item"
    }
  ]
}
