{
  "schema_version": 1,
  "id": "rpg_battle_hud",
  "label": "RPG Battle HUD",
  "canvas_size": [960, 540],
  "nodes": [
    {
      "id": "battlefield",
      "type": "panel",
      "slot": "panel_primary",
      "rect": [24, 24, 620, 318],
      "text": "Battlefield"
    },
    {
      "id": "enemy_icon_a",
      "type": "icon",
      "slot": "icon_frame",
      "rect": [438, 86, 76, 76],
      "text": "E1"
    },
    {
      "id": "enemy_icon_b",
      "type": "icon",
      "slot": "icon_frame",
      "rect": [526, 166, 76, 76],
      "text": "E2"
    },
    {
      "id": "party_panel",
      "type": "panel",
      "slot": "panel_secondary",
      "rect": [24, 360, 390, 150],
      "text": "Party"
    },
    {
      "id": "hp_bar",
      "type": "bar",
      "slot": "status_bar",
      "rect": [54, 424, 286, 22],
      "text": "HP"
    },
    {
      "id": "command_panel",
      "type": "panel",
      "slot": "panel_secondary",
      "rect": [436, 360, 500, 150],
      "text": "Command"
    },
    {
      "id": "attack_button",
      "type": "button",
      "slot": "button_primary",
      "rect": [466, 418, 142, 42],
      "text": "Attack"
    },
    {
      "id": "skill_button",
      "type": "button",
      "slot": "button_primary",
      "rect": [624, 418, 142, 42],
      "text": "Skill"
    },
    {
      "id": "item_button",
      "type": "button",
      "slot": "button_primary",
      "rect": [782, 418, 122, 42],
      "text": "Item"
    }
  ]
}
