{
  "schema_version": 1,
  "id": "dialog_choice",
  "label": "Dialog Choice",
  "canvas_size": [960, 540],
  "nodes": [
    {
      "id": "dialog_panel",
      "type": "panel",
      "slot": "panel_primary",
      "rect": [120, 288, 720, 190],
      "text": "Dialog"
    },
    {
      "id": "portrait_frame",
      "type": "icon",
      "slot": "icon_frame",
      "rect": [150, 318, 112, 112],
      "text": "NPC"
    },
    {
      "id": "choice_a",
      "type": "button",
      "slot": "button_primary",
      "rect": [500, 326, 284, 40],
      "text": "Accept"
    },
    {
      "id": "choice_b",
      "type": "button",
      "slot": "button_primary",
      "rect": [500, 382, 284, 40],
      "text": "Decline"
    },
    {
      "id": "dialog_line",
      "type": "panel",
      "slot": "panel_secondary",
      "rect": [286, 326, 188, 96],
      "text": "Text"
    }
  ]
}
